A2: Visitor Number 125580

A1: Start Benchmarking Services

A3: Balance Sheet For the period ended
A4: ASSETS | C4: Amount in Local Currency | D4: % | E4: Chart of Account (Codes)
B5: Liquidity
A6: 6 | B6: Non-Earning Liquid Assets | C6: 50000 | D6: =SUM(C6/C37*100) -> 0.14139959982216455 | E6: 101 + 103 + 104
A7: 7 | B7: Liquid Investments (Short Term Investments) | C7: 4694993 | D7: =SUM(C7/C37*100) -> 13.277402627357276 | E7: 102 + 140
A8: 8 | B8: Liquidity Reserves | C8: =SUM(C6:C7) -> 4744993 | D8: =SUM(C8/C37*100) -> 13.418802227179441
A10: 10 | B10: Loan Outstanding: | D10: =SUM(C10/C41*100) -> 0
A11: 11 | B11: Loans Receivable - Current | C11: 18283473 | D11: =SUM(C11/C37*100) -> 51.705515311187014 | E11: 150
A13: 13 | B13: Loan Delinquent (1-12 months)
A14: 14 | B14: Loans Receivable - Restructured | C14: 1679542 | D14: =SUM(C14/C37*100) -> 4.7497313336903577 | E14: 151
A15: 15 | B15: Loans Receivable- Past Due for 1-12 months | C15: 5060976 | D15: =SUM(C15/C37*100) -> 14.312399622191583 | E15: 152
A16: 16 | B16: Total Loan Delinquent (1-12 months) | C16: =SUM(C14:C15) -> 6740518 | D16: =SUM(C16/C37*100) -> 19.062130955881941
A18: 18 | B18: Loan Delinquent (> 12 months)
A19: 19 | B19: Loans Receivable - Past Due for >12 months | C19: 0 | D19: =SUM(C19/C37*100) -> 0 | E19: 152
A20: 20 | B20: Loans Receivable-Loans in Litigation | C20: 0 | D20: =SUM(C20/C37*100) -> 0 | E20: 153
A21: 21 | B21: Total Loan Delinquent (>12 months) | C21: =SUM(C19:C20) -> 0 | D21: =SUM(C21/C52*100) -> 0
A22: 22 | B22: Total Loan Delinquency | C22: =SUM(C16+C21) -> 6740518
A23: 23 | B23: Total Loan Portfolio | C23: =SUM(C11+C22) -> 25023991 | D23: =SUM(C23/C37*100) -> 70.767646267068955
A25: 25 | B25: Allowance for Probable Losses on Loans | E25: 154
A26: 26 | B26: Allowance for Probable Losses on Loans - >12 months | C26: 0 | D26: =SUM(C26/C37*100) -> 0
A27: 27 | B27: Allowance for Probable Losses on Loans - 1 to 12 months | C27: 1422659 | D27: =SUM(C27/C37*100) -> 4.0232682656680163
A28: 28 | B28: Total Provision for Doubtful Loans | C28: =SUM(C26:C27) -> 1422659 | D28: =SUM(C28/C37*100) -> 4.0232682656680163
A29: 29 | B29: Net Loans Outstanding | C29: =SUM(C23-C28) -> 23601332 | D29: =SUM(C29/C37*100) -> 66.744378001400932
A31: 31 | B31: Investments:
A32: 32 | B32: Financial Investments | C32: 502502 | D32: =SUM(C32/C37*100) -> 1.4210716341967466 | E32: 182 + 184
A33: 33 | B33: Non Financial Investments | C33: 0 | D33: =SUM(C33/C37*100) -> 0 | E33: 185
A34: 34 | B34: Total Investments | C34: =SUM(C32:C33) -> 502502 | D34: =SUM(C34/C37*100) -> 1.4210716341967466
A35: 35 | B35: Non-Earning Assets | C35: 6511952 | D35: =SUM(C35/C37*100) -> 18.415748137222881 | E35: 112; 162; 170; 174; 191; 192; 193; 196; 197; 205; 206; 208; 209; 210; 250; 151; 252; 256; 257; 258; 259; 260; 261
A36: 36 | B36: Problem Assets | C36: 0 | D36: =SUM(C36/C37*100) -> 0 | E36: May fall under 261
A37: 37 | B37: Total Assets | C37: =SUM(C8+C29+C34+C35) -> 35360779 | D37: =SUM(C37/C37*100) -> 100
A39: LIABILITIES
A40: 40 | B40: Savings Deposits | C40: 26809988 | D40: =SUM(C40/C56*100) -> 75.818431488740686 | E40: 300; 303
A41: 41 | B41: Non-Interest Bearing Liabilities & Short Term Payables | C41: 784149 | D41: =SUM(C41/C56*100) -> 2.2175670960190104 | E41: 308; 309; 310; 311; 312; 313; 314; 316
A42: 42 | B42: Non-Interest Bearing Liabilities -Non Short-Term Payables | C42: 1824282 | D42: =SUM(C42/C56*100) -> 5.1590548952555597 | E42: 331; 332; 333; 334
A43: 43 | B43: Total Non-Interest Bearing Liabilities | C43: =SUM(C41:C42) -> 2608431 | D43: =SUM(C43/C56*100) -> 7.376621991274571
A45: 45 | B45: External Credit | D45: =SUM(C45/C56*100) -> 0.00
A46: 46 | B46: Loans Payable -Short Term | C46: 0 | D46: =SUM(C46/C56*100) -> 0.00 | E46: 304
A47: 47 | B47: Loans Payable -Long Term | C47: 0 | D47: =SUM(C47/C56*100) -> 0.00 | E47: 320
A48: 48 | B48: Total External Credit | C48: =SUM(C46:C47) -> 0 | D48: =SUM(C48/C56*100) -> 0.00
A49: 49 | B49: Total Liabilities | C49: =SUM(C40+C43+C48) -> 29418419 | D49: =SUM(C49/C56*100) -> 83.195053480015247
A51: EQUITY
A52: 52 | B52: Member Share Capital | C52: 4570462 | D52: =SUM(C52/C56*100) -> 12.925229956048199 | E52: 361
A53: 53 | B53: Total Institutional Capital | C53: 886998 | D53: =SUM(C53/C56*100) -> 2.508423244861206 | E53: 381; 391; 362
A54: 54 | B54: Transitory Capital | C54: 484900 | D54: =SUM(C54/C56*100) -> 1.3712933190753518 | E54: 392; 393
A55: 55 | B55: Total Equity | C55: =SUM(C52:C54) -> 5942360 | D55: =SUM(C55/C56*100) -> 16.804946519984753
A56: 56 | B56: Total Liabilities & Equities | C56: =SUM(C49+C55) -> 35360779 | D56: =SUM(C56/C56*100) -> 100.00
A57: INCOME STATEMENT for the months ended
A58: 62 | B58: INCOME
A59: 63 | B59: Loan Income | C59: 3103253 | D59: =SUM(C63/C69)*100 -> 70.956198009044058 | E59: 401; 405; 406; 407; 408
A60: 64 | B60: Less: Insurance Premiums paid on loans | C60: 0 | E60: 553 (portion paid for loan insurance)
A61: 65 | B61: Net Loan Income | C61: =SUM(C63-C64) -> 3103253 | D61: =SUM(C65/C69)*100 -> 70.956198009044058
A62: 66 | B62: Total Liquid Investment Income | C62: 1032876
A63: 67 | B63: Total Financial Investment Income | C63: 237348 | D63: =SUM(C67/C69)*100 -> 5.4269863543354635 | E63: 409
A64: 68 | B64: Income from Non-Financial Investments | C64: 0 | D64: =SUM(C66/C69)*100 -> 23.616815636620476 | E64: 410
A65: 69 | B65: Total Income | C65: =SUM(C65:C68) -> 4373477 | D65: =SUM(C69/C69 * 100) -> 100.00
A67: FINANCIAL COSTS
A68: 72 | B68: Interest Cost on Savings Deposits | C68: 1174096 | D68: =SUM(C72/C69*100) -> 26.845825415338869 | E68: 401
A69: 73 | B69: Interest Cost on External Credit | C69: - | D69: =SUM(C73/C69*100) -> 0.00 | E69: 502; 503
A70: 74 | B70: Total Financial Costs excluding Interest Cost on Shares | C70: =SUM(C72:C73) -> 1174096 | D70: =SUM(C74/C69*100) -> 26.845825415338869
A71: 75 | B71: Gross Income Margin | C71: =SUM(C69-C74) -> 3199381 | D71: =SUM(C75/C69*100) -> 73.154174584661121
A72: 76 | C72: xxxx =SUM(C7x:C7x) | D72: 100.00
A73: OPERATING EXPENSES
A74: 78 | B74: Personnel | C74: 300000 | D74: =SUM(C78/C69*100) -> 6.8595307577929425 | E74: 516; 517; 518; 519
A75: 79 | B75: Governance | C75: 300000 | D75: =SUM(C79/C69*100) -> 6.8595307577929425 | E75: 538; 539; 560; 561
A76: 80 | B76: Marketing | C76: 50000 | D76: =SUM(C80/C69*100) -> 1.1432551262988235 | E76: 566; 567; 568; 570;
A77: 81 | B77: Depreciation | C77: 200000 | D77: =SUM(C81/C65*100) -> 6.4448499687263654 | E77: 576; 577
A78: 82 | B78: Administration | C78: 2038779 | D78: =SUM(C82/C69*100) -> 46.616890862807786 | E78: 540; 551; 552; 553; 554; 555; 556; 557; 558; 559; 562; 563; 564; 565; 575
A79: 83 | B79: Total Operating Expenses before Probable Loss on Delinquent Loans | C79: =SUM(C78:C82) -> 2888779 | D79: =SUM(C83/C69*100) -> 66.052228009887784
A80: 84 | B80: Provision for Probable Losses on Loans | C80: 1422659 | D80: =SUM(C84/C69*100) -> 32.529243894503161 | E80: 578
A81: 85 | B81: Total Operating Expenses | C81: =SUM(C83:C84) -> 4311438 | D81: =SUM(C85/C69*100) -> 98.581471904390952
A82: 86 | B82: NET INCOME before other Income/Expense | C82: =SUM(C75-C85) -> -1112057 | D82: =SUM(C86/C69*100) -> -25.427297319729821
A83: 87 | B83: Other Income/Expense | C83: 0 | D83: =SUM(C87/C69*100) -> 0.00 | E83: 590; 591; 592; 593
A84: 88 | B84: Net Income | C84: =SUM(C86:C87) -> -1112057 | D84: =SUM(C88/C69*100) -> -25.427297319729821
A86: 90 | B86: Allocation of Net Income:
A87: 91 | B87: General Reserve Fund | C87: 0
A88: 92 | B88: Interest Cost on Shares | C88: 0
A89: 93 | B89: Patronage Refund | C89: 0
A90: 94 | B90: Other Statutory Accounts | C90: 0
A91: 95 | B91: Undivided Net Income | C91: -1112057
A92: 96 | B92: Total | C92: =SUM(C91:C95) -> -1112057
A94: 98 | B94: Total Charge off Delinquent Loans | C94: 100000
A95: 99 | B95: Quarterly Loan Charge Offs | C95: 50000
A96: 100 | B96: Accumulated Loan Recoveries | C96: 230000
A97: 101 | B97: Accumulate Loan Charge Offs | C97: 400000
A98: 102 | B98: Net Loan Portfolio of the previous year | C98: 24000000
A99: 103 | B99: Gross Loan Portfolio of the previous year | C99: 26000000
A100: 104 | B100: Liquid Investment of the previous year | C100: 4000000