A2: Balance Sheet

A1: {MEMBER_NAME}
A2: {TOPMENU}

A4: ASSETS | C4: {DATE1} | D4: {DATE2} | E4: {DATE3} | F4: {DATE4} | G4: {DATE5}
B5: Liquidity
B6: Non-Earning Liquid Assets | C6: 50000 | D6: 50000 | E6: 50000 | F6: 50000 | G6: 50000
B7: Liquid Investments (Short Term Investments) | C7: 4694993 | D7: 4694993 | E7: 4694993 | F7: 4694993 | G7: 4694993
B8: Liquidity Reserves | C8: =SUM(C6:C7) -> 4744993 | D8: =SUM(C6:C7) -> 4744993 | E8: =SUM(C6:C7) -> 4744993 | F8: =SUM(C6:C7) -> 4744993 | G8: =SUM(C6:C7) -> 4744993
B10: Loan Outstanding:
B11: Loans Receivable - Current | C11: 18283473 | D11: 18283473 | E11: 18283473 | F11: 18283473 | G11: 18283473
B13: Loan Delinquent (1-12 months)
B14: Loans Receivable - Restructured | C14: 1679542 | D14: 1679542 | E14: 1679542 | F14: 1679542 | G14: 1679542
B15: Loans Receivable- Past Due for 1-12 months | C15: 5060976 | D15: 5060976 | E15: 5060976 | F15: 5060976 | G15: 5060976
B16: Total Loan Delinquent (1-12 months) | C16: =SUM(C14:C15) -> 6740518 | D16: =SUM(C14:C15) -> 6740518 | E16: =SUM(C14:C15) -> 6740518 | F16: =SUM(C14:C15) -> 6740518 | G16: =SUM(C14:C15) -> 6740518
B18: Loan Delinquent (> 12 months)
B19: Loans Receivable - Past Due for >12 months | C19: 0 | D19: 0 | E19: 0 | F19: 0 | G19: 0
B20: Loans Receivable-Loans in Litigation | C20: 0 | D20: 0 | E20: 0 | F20: 0 | G20: 0
B21: Total Loan Delinquent (>12 months) | C21: =SUM(C19:C20) -> 0 | D21: =SUM(C19:C20) -> 0 | E21: =SUM(C19:C20) -> 0 | F21: =SUM(C19:C20) -> 0 | G21: =SUM(C19:C20) -> 0
B22: Total Loan Delinquency | C22: =SUM(C16+C21) -> 6740518 | D22: =SUM(C16+C21) -> 6740518 | E22: =SUM(C16+C21) -> 6740518 | F22: =SUM(C16+C21) -> 6740518 | G22: =SUM(C16+C21) -> 6740518
B23: Total Loan Portfolio | C23: =SUM(C11+C22) -> 25023991 | D23: =SUM(C11+C22) -> 25023991 | E23: =SUM(C11+C22) -> 25023991 | F23: =SUM(C11+C22) -> 25023991 | G23: =SUM(C11+C22) -> 25023991
B25: Allowance for Probable Losses on Loans
B26: Allowance for Probable Losses on Loans - >12 months | C26: 0 | D26: 0 | E26: 0 | F26: 0 | G26: 0
B27: Allowance for Probable Losses on Loans - 1 to 12 months | C27: 1422659 | D27: 1422659 | E27: 1422659 | F27: 1422659 | G27: 1422659
B28: Total Provision for Doubtful Loans | C28: =SUM(C26:C27) -> 1422659 | D28: =SUM(C26:C27) -> 1422659 | E28: =SUM(C26:C27) -> 1422659 | F28: =SUM(C26:C27) -> 1422659 | G28: =SUM(C26:C27) -> 1422659
B29: Net Loans Outstanding | C29: =SUM(C23-C28) -> 23601332 | D29: =SUM(C23-C28) -> 23601332 | E29: =SUM(C23-C28) -> 23601332 | F29: =SUM(C23-C28) -> 23601332 | G29: =SUM(C23-C28) -> 23601332
B31: Investments:
B32: Financial Investments | C32: 502502 | D32: 502502 | E32: 502502 | F32: 502502 | G32: 502502
B33: Non Financial Investments | C33: 0 | D33: 0 | E33: 0 | F33: 0 | G33: 0
B34: Total Investments | C34: =SUM(C32:C33) -> 502502 | D34: =SUM(C32:C33) -> 502502 | E34: =SUM(C32:C33) -> 502502 | F34: =SUM(C32:C33) -> 502502 | G34: =SUM(C32:C33) -> 502502
B35: Non-Earning Assets | C35: 6511952 | D35: 6511952 | E35: 6511952 | F35: 6511952 | G35: 6511952
B36: Problem Assets | C36: 0 | D36: 0 | E36: 0 | F36: 0 | G36: 0
B37: Total Assets | C37: =SUM(C8+C29+C34+C35) -> 35360779 | D37: =SUM(C8+C29+C34+C35) -> 35360779 | E37: =SUM(C8+C29+C34+C35) -> 35360779 | F37: =SUM(C8+C29+C34+C35) -> 35360779 | G37: =SUM(C8+C29+C34+C35) -> 35360779
A39: LIABILITIES
B40: Savings Deposits | C40: 26809988 | D40: 26809988 | E40: 26809988 | F40: 26809988 | G40: 26809988
B41: Non-Interest Bearing Liabilities & Short Term Payables | C41: 784149 | D41: 784149 | E41: 784149 | F41: 784149 | G41: 784149
B42: Non-Interest Bearing Liabilities -Non Short-Term Payables | C42: 1824282 | D42: 1824282 | E42: 1824282 | F42: 1824282 | G42: 1824282
B43: Total Non-Interest Bearing Liabilities | C43: =SUM(C41:C42) -> 2608431 | D43: =SUM(C41:C42) -> 2608431 | E43: =SUM(C41:C42) -> 2608431 | F43: =SUM(C41:C42) -> 2608431 | G43: =SUM(C41:C42) -> 2608431
B45: External Credit
B46: Loans Payable -Short Term | C46: 0 | D46: 0 | E46: 0 | F46: 0 | G46: 0
B47: Loans Payable -Long Term | C47: 0 | D47: 0 | E47: 0 | F47: 0 | G47: 0
B48: Total External Credit | C48: =SUM(C46:C47) -> 0 | D48: =SUM(C46:C47) -> 0 | E48: =SUM(C46:C47) -> 0 | F48: =SUM(C46:C47) -> 0 | G48: =SUM(C46:C47) -> 0
B49: Total Liabilities | C49: =SUM(C40+C43+C48) -> 29418419 | D49: =SUM(C40+C43+C48) -> 29418419 | E49: =SUM(C40+C43+C48) -> 29418419 | F49: =SUM(C40+C43+C48) -> 29418419 | G49: =SUM(C40+C43+C48) -> 29418419
A51: EQUITY
B52: Member Share Capital | C52: 4570462 | D52: 4570462 | E52: 4570462 | F52: 4570462 | G52: 4570462
B53: Total Institutional Capital | C53: 886998 | D53: 886998 | E53: 886998 | F53: 886998 | G53: 886998
B54: Transitory Capital | C54: 484900 | D54: 484900 | E54: 484900 | F54: 484900 | G54: 484900
B55: Total Equity | C55: =SUM(C52:C54) -> 5942360 | D55: =SUM(C52:C54) -> 5942360 | E55: =SUM(C52:C54) -> 5942360 | F55: =SUM(C52:C54) -> 5942360 | G55: =SUM(C52:C54) -> 5942360
B56: Total Liabilities & Equities | C56: =SUM(C49+C55) -> 35360779 | D56: =SUM(C49+C55) -> 35360779 | E56: =SUM(C49+C55) -> 35360779 | F56: =SUM(C49+C55) -> 35360779 | G56: =SUM(C49+C55) -> 35360779
A58: INCOME
B59: Loan Income | C59: 3103253 | D59: 3103253 | E59: 3103253 | F59: 3103253 | G59: 3103253
B60: Less: Insurance Premiums paid on loans | C60: 0 | D60: 0 | E60: 0 | F60: 0 | G60: 0
B61: Net Loan Income | C61: =SUM(C63-C64) -> 3103253 | D61: =SUM(C63-C64) -> 3103253 | E61: =SUM(C63-C64) -> 3103253 | F61: =SUM(C63-C64) -> 3103253 | G61: =SUM(C63-C64) -> 3103253
B62: Total Liquid Investment Income | C62: 1032876 | D62: 1032876 | E62: 1032876 | F62: 1032876 | G62: 1032876
B63: Total Financial Investment Income | C63: 237348 | D63: 237348 | E63: 237348 | F63: 237348 | G63: 237348
B64: Income from Non-Financial Investments | C64: 0 | D64: 0 | E64: 0 | F64: 0 | G64: 0
B65: Total Income | C65: =SUM(C65:C68) -> 4373477 | D65: =SUM(C65:C68) -> 4373477 | E65: =SUM(C65:C68) -> 4373477 | F65: =SUM(C65:C68) -> 4373477 | G65: =SUM(C65:C68) -> 4373477
A67: FINANCIAL COSTS
B68: Interest Cost on Savings Deposits | C68: 1174096 | D68: 1174096 | E68: 1174096 | F68: 1174096 | G68: 1174096
B69: Interest Cost on External Credit | C69: {C73_1} | D69: {C73_2} | E69: {C73_3} | F69: {C73_4} | G69: {C73_5}
B70: Total Financial Costs excluding Interest Cost on Shares | C70: =SUM(C72:C73) -> 1174096 | D70: =SUM(C72:C73) -> 1174096 | E70: =SUM(C72:C73) -> 1174096 | F70: =SUM(C72:C73) -> 1174096 | G70: =SUM(C72:C73) -> 1174096
B71: Gross Income Margin | C71: =SUM(C69-C74) -> 3199381 | D71: =SUM(C69-C74) -> 3199381 | E71: =SUM(C69-C74) -> 3199381 | F71: =SUM(C69-C74) -> 3199381 | G71: =SUM(C69-C74) -> 3199381
A73: OPERATING EXPENSES
B74: Personnel | C74: 300000 | D74: 300000 | E74: 300000 | F74: 300000 | G74: 300000
B75: Governance | C75: 300000 | D75: 300000 | E75: 300000 | F75: 300000 | G75: 300000
B76: Marketing | C76: 50000 | D76: 50000 | E76: 50000 | F76: 50000 | G76: 50000
B77: Depreciation | C77: 200000 | D77: 200000 | E77: 200000 | F77: 200000 | G77: 200000
B78: Administration | C78: 2038779 | D78: 2038779 | E78: 2038779 | F78: 2038779 | G78: 2038779