A1: Name of Credit Union: {MEMBER_NAME}

A1: Balance Sheet | B1: PEARLS RATIOS

A3: Balance Sheet For the period ended {listrow.BALANCE_SHEET}
A4: ASSETS | C4: Amount in Local Currency | D4: %
B5: Liquidity
B6: Non-Earning Liquid Assets | C6: 50000 | D6: =SUM(C6/C37*100) -> 0.14139959982216455
B7: Liquid Investments (Short Term Investments) | C7: 4694993 | D7: =SUM(C7/C37*100) -> 13.277402627357276
B8: Liquidity Reserves | C8: =SUM(C6:C7) -> 4744993 | D8: =SUM(C8/C37*100) -> 13.418802227179441
B10: Loan Outstanding: | D10: =SUM(C10/C41*100) -> 0
B11: Loans Receivable - Current | C11: 18283473 | D11: =SUM(C11/C37*100) -> 51.705515311187014
B13: Loan Delinquent (1-12 months)
B14: Loans Receivable - Restructured | C14: 1679542 | D14: =SUM(C14/C37*100) -> 4.7497313336903577
B15: Loans Receivable- Past Due for 1-12 months | C15: 5060976 | D15: =SUM(C15/C37*100) -> 14.312399622191583
B16: Total Loan Delinquent (1-12 months) | C16: =SUM(C14:C15) -> 6740518 | D16: =SUM(C16/C37*100) -> 19.062130955881941
B18: Loan Delinquent (> 12 months)
B19: Loans Receivable - Past Due for >12 months | C19: 0 | D19: =SUM(C19/C37*100) -> 0
B20: Loans Receivable-Loans in Litigation | C20: 0 | D20: =SUM(C20/C37*100) -> 0
B21: Total Loan Delinquent (>12 months) | C21: =SUM(C19:C20) -> 0 | D21: =SUM(C21/C52*100) -> 0
B22: Total Loan Delinquency | C22: =SUM(C16+C21) -> 6740518 | D22: {P22}
B23: Total Loan Portfolio | C23: =SUM(C11+C22) -> 25023991 | D23: =SUM(C23/C37*100) -> 70.767646267068955
B25: Allowance for Probable Losses on Loans
B26: Allowance for Probable Losses on Loans - >12 months | C26: 0 | D26: =SUM(C26/C37*100) -> 0
B27: Allowance for Probable Losses on Loans - 1 to 12 months | C27: 1422659 | D27: =SUM(C27/C37*100) -> 4.0232682656680163
B28: Total Provision for Doubtful Loans | C28: =SUM(C26:C27) -> 1422659 | D28: =SUM(C28/C37*100) -> 4.0232682656680163
B29: Net Loans Outstanding | C29: =SUM(C23-C28) -> 23601332 | D29: =SUM(C29/C37*100) -> 66.744378001400932
B31: Investments:
B32: Financial Investments | C32: 502502 | D32: =SUM(C32/C37*100) -> 1.4210716341967466
B33: Non Financial Investments | C33: 0 | D33: =SUM(C33/C37*100) -> 0
B34: Total Investments | C34: =SUM(C32:C33) -> 502502 | D34: =SUM(C34/C37*100) -> 1.4210716341967466
B35: Non-Earning Assets | C35: 6511952 | D35: =SUM(C35/C37*100) -> 18.415748137222881
B36: Problem Assets | C36: 0 | D36: =SUM(C36/C37*100) -> 0
B37: Total Assets | C37: =SUM(C8+C29+C34+C35) -> 35360779 | D37: =SUM(C37/C37*100) -> 100
A39: LIABILITIES
B40: Savings Deposits | C40: 26809988 | D40: =SUM(C40/C56*100) -> 75.818431488740686
B41: Non-Interest Bearing Liabilities & Short Term Payables | C41: 784149 | D41: =SUM(C41/C56*100) -> 2.2175670960190104
B42: Non-Interest Bearing Liabilities -Non Short-Term Payables | C42: 1824282 | D42: =SUM(C42/C56*100) -> 5.1590548952555597
B43: Total Non-Interest Bearing Liabilities | C43: =SUM(C41:C42) -> 2608431 | D43: =SUM(C43/C56*100) -> 7.376621991274571
B45: External Credit | D45: =SUM(C45/C56*100) -> {P45}
B46: Loans Payable -Short Term | C46: 0 | D46: =SUM(C46/C56*100) -> {P46}
B47: Loans Payable -Long Term | C47: 0 | D47: =SUM(C47/C56*100) -> {P46}
B48: Total External Credit | C48: =SUM(C46:C47) -> 0 | D48: =SUM(C48/C56*100) -> {P48}
B49: Total Liabilities | C49: =SUM(C40+C43+C48) -> 29418419 | D49: =SUM(C49/C56*100) -> 83.195053480015247
A51: EQUITY
B52: Member Share Capital | C52: 4570462 | D52: =SUM(C52/C56*100) -> 12.925229956048199
B53: Total Institutional Capital | C53: 886998 | D53: =SUM(C53/C56*100) -> 2.508423244861206
B54: Transitory Capital | C54: 484900 | D54: =SUM(C54/C56*100) -> 1.3712933190753518
B55: Total Equity | C55: =SUM(C52:C54) -> 5942360 | D55: =SUM(C55/C56*100) -> 16.804946519984753
B56: Total Liabilities & Equities | C56: =SUM(C49+C55) -> 35360779 | D56: =SUM(C56/C56*100) -> {P56}
A57: INCOME STATEMENT for the {listrow.INCOME_MONTH} months ended {listrow.INCOME_ENDED}
A58: INCOME
B59: Loan Income | C59: 3103253 | D59: =SUM(C63/C69)*100 -> 70.956198009044058
B60: Less: Insurance Premiums paid on loans | C60: 0 | D60: {P64}
B61: Net Loan Income | C61: =SUM(C63-C64) -> 3103253 | D61: =SUM(C65/C69)*100 -> 70.956198009044058
B62: Total Liquid Investment Income | C62: 1032876 | D62: {P66}
B63: Total Financial Investment Income | C63: 237348 | D63: =SUM(C67/C69)*100 -> 5.4269863543354635
B64: Income from Non-Financial Investments | C64: 0 | D64: =SUM(C66/C69)*100 -> 23.616815636620476
B65: Total Income | C65: =SUM(C65:C68) -> 4373477 | D65: =SUM(C69/C69 * 100) -> {P69}
A67: FINANCIAL COSTS
B68: Interest Cost on Savings Deposits | C68: 1174096 | D68: =SUM(C72/C69*100) -> 26.845825415338869
B69: Interest Cost on External Credit | C69: {C73} | D69: =SUM(C73/C69*100) -> {P73}
B70: Total Financial Costs excluding Interest Cost on Shares | C70: =SUM(C72:C73) -> 1174096 | D70: =SUM(C74/C69*100) -> 26.845825415338869
B71: Gross Income Margin | C71: =SUM(C69-C74) -> 3199381 | D71: =SUM(C75/C69*100) -> 73.154174584661121
A73: OPERATING EXPENSES
B74: Personnel | C74: 300000 | D74: =SUM(C78/C69*100) -> 6.8595307577929425
B75: Governance | C75: 300000 | D75: =SUM(C79/C69*100) -> 6.8595307577929425
B76: Marketing | C76: 50000 | D76: =SUM(C80/C69*100) -> 1.1432551262988235
B77: Depreciation | C77: 200000 | D77: =SUM(C81/C65*100) -> 6.4448499687263654
B78: Administration | C78: 2038779 | D78: =SUM(C82/C69*100) -> 46.616890862807786
B79: Total Operating Expenses before Probable Loss on Delinquent Loans | C79: =SUM(C78:C82) -> 2888779 | D79: =SUM(C83/C69*100) -> 66.052228009887784
B80: Provision for Probable Losses on Loans | C80: 1422659 | D80: =SUM(C84/C69*100) -> 32.529243894503161