A2: Stat New Benchmarking Services

A1: Welcome ! : {NAME} - > [ {MEMBER_NAME} ]

A1: My History | B1: Edit Profile | C1: My Community | D1: PEARSL Rating | E1: Logout
A2: {PAGE_LIST}

A1: Balance Sheet

A1: PEARLS RATIOS

A3: Balance Sheet For the period ended {listrow.BALANCE_SHEET}
A4: ASSETS | C4: Amount in Local Currency | D4: %
B5: Liquidity
B6: Non-Earning Liquid Assets | C6: 50000 | D6: {ANS6}
B7: Liquid Investments (Short Term Investments) | C7: 4694993 | D7: {ANS7}
B8: Liquidity Reserves | C8: =SUM(C6:C7) -> 4744993 | D8: {ANS8}
B10: Loan Outstanding:
B11: Loans Receivable - Current | C11: 18283473
B13: Loan Delinquent (1-12 months)
B14: Loans Receivable - Restructured | C14: 1679542
B15: Loans Receivable- Past Due for 1-12 months | C15: 5060976
B16: Total Loan Delinquent (1-12 months) | C16: =SUM(C14:C15) -> 6740518 | D16: {ANS16}
B18: Loan Delinquent (> 12 months)
B19: Loans Receivable - Past Due for >12 months | C19: 0
B20: Loans Receivable-Loans in Litigation | C20: 0
B21: Total Loan Delinquent (>12 months) | C21: =SUM(C19:C20) -> 0 | D21: {ANS21}
B22: Total Loan Delinquency | C22: =SUM(C16+C21) -> 6740518 | D22: {ANS22}
B23: Total Loan Portfolio | C23: =SUM(C11+C22) -> 25023991 | D23: {ANS23}
B25: Allowance for Probable Losses on Loans
B26: Allowance for Probable Losses on Loans - >12 months | C26: 0 | D26: {ANS26}
B27: Allowance for Probable Losses on Loans - 1 to 12 months | C27: 1422659 | D27: {ANS27}
B28: Total Provision for Doubtful Loans | C28: =SUM(C26:C27) -> 1422659
B29: Net Loans Outstanding | C29: =SUM(C23-C28) -> 23601332 | D29: {ANS29}
B31: Investments:
B32: Financial Investments | C32: 502502 | D32: {ANS32}
B33: Non Financial Investments | C33: 0 | D33: {ANS33}
B34: Total Investments | C34: =SUM(C32:C33) -> 502502
B35: Non-Earning Assets | C35: 6511952 | D35: {ANS35}
B36: Problem Assets | C36: 0 | D36: {ANS36}
B37: Total Assets | C37: =SUM(C8+C29+C34+C35) -> 35360779 | D37: {ANS37}
A39: LIABILITIES
B40: Savings Deposits | C40: 26809988 | D40: {ANS40}
B41: Non-Interest Bearing Liabilities & Short Term Payables | C41: 784149 | D41: {ANS41}
B42: Non-Interest Bearing Liabilities -Non Short-Term Payables | C42: 1824282
B43: Total Non-Interest Bearing Liabilities | C43: =SUM(C41:C42) -> 2608431 | D43: {ANS43}
B45: External Credit
B46: Loans Payable -Short Term | C46: 0 | D46: {ANS46}
B47: Loans Payable -Long Term | C47: 0
B48: Total External Credit | C48: =SUM(C46:C47) -> 0 | D48: {ANS48}
B49: Total Liabilities | C49: =SUM(C40+C43+C48) -> 29418419
A51: EQUITY
B52: Member Share Capital | C52: 4570462 | D52: {ANS52}
B53: Total Institutional Capital | C53: 886998 | D53: {ANS53}
B54: Transitory Capital | C54: 484900 | D54: {ANS54}
B55: Total Equity | C55: =SUM(C52:C54) -> 5942360
B56: Total Liabilities & Equities | C56: =SUM(C49+C55) -> 35360779
A57: INCOME STATEMENT for the {listrow.INCOME_MONTH} months ended {listrow.INCOME_ENDED}
A58: INCOME
B59: Loan Income | C59: 3103253
B60: Less: Insurance Premiums paid on loans | C60: 0
B61: Net Loan Income | C61: =SUM(C63-C64) -> 3103253 | D61: {ANS65}
B62: Total Liquid Investment Income | C62: 1032876 | D62: {ANS66}
B63: Total Financial Investment Income | C63: 237348 | D63: {ANS67}
B64: Income from Non-Financial Investments | C64: 0 | D64: {ANS68}
B65: Total Income | C65: =SUM(C65:C68) -> 4373477
A67: FINANCIAL COSTS
B68: Interest Cost on Savings Deposits | C68: 1174096 | D68: {ANS6}
B69: Interest Cost on External Credit | C69: {C73} | D69: {ANS73}
B70: Total Financial Costs excluding Interest Cost on Shares | C70: =SUM(C72:C73) -> 1174096
B71: Gross Income Margin | C71: =SUM(C69-C74) -> 3199381 | D71: {ANS75}
A73: OPERATING EXPENSES
B74: Personnel | C74: 300000
B75: Governance | C75: 300000
B76: Marketing | C76: 50000
B77: Depreciation | C77: 200000
B78: Administration | C78: 2038779
B79: Total Operating Expenses before Probable Loss on Delinquent Loans | C79: =SUM(C78:C82) -> 2888779 | D79: {ANS83}
B80: Provision for Probable Losses on Loans | C80: 1422659 | D80: {ANS84}
B81: Total Operating Expenses | C81: =SUM(C83:C84) -> 4311438
B82: NET INCOME before other Income/Expense | C82: =SUM(C75-C85) -> -1112057
B83: Other Income/Expense | C83: 0 | D83: {ANS87}
B84: Net Income | C84: =SUM(C86:C87) -> -1112057 | D84: {ANS88}
B86: Allocation of Net Income:
B87: General Reserve Fund | C87: 0
B88: Interest Cost on Shares | C88: 0 | D88: {ANS92}
B89: Patronage Refund | C89: 0
B90: Other Statutory Accounts | C90: 0
B91: Undivided Net Income | C91: -1112057
B92: Total | C92: =SUM(C91:C95) -> -1112057
B94: Total Charge off Delinquent Loans | C94: 100000 | D94: {ANS98}
B95: Quarterly Loan Charge Offs | C95: 50000 | D95: {ANS99}
B96: Accumulated Loan Recoveries | C96: 230000 | D96: {ANS100}
B97: Accumulate Loan Charge Offs | C97: 400000 | D97: {ANS101}
B98: Net Loan Portfolio of the previous year | C98: 24000000 | D98: {ANS102}
B99: Gross Loan Portfolio of the previous year | C99: 26000000 | D99: {ANS103}
B100: Liquid Investment of the previous year | C100: 4000000 | D100: {ANS104}
B101: Financial Investments of the previous year | C101: 400000 | D101: {ANS105}
B102: Non-Financial Investment of the previous year | C102: 0 | D102: {ANS106}
B103: Savings Deposit of the previous year | C103: 25000000 | D103: {ANS107}
B104: External Credit of the previous year | C104: 0 | D104: {ANS108}
B105: Members Shares of the previous year | C105: 4000000 | D105: {ANS109}
B106: Total Assets of the previous year | C106: 34000000 | D106: {ANS110}
B107: Institutional Capital of the previous year | C107: 700000 | D107: {ANS111}
B108: Members this year | C108: 500 | D108: {ANS112}
B109: Members last year | C109: 350 | D109: {ANS113}