A1: {MEMBER_NAME}
A2: {TOPMENU}

A1: New Benchmarking Services

A1: Step 1 Start Benchmarking | B1: Step 2 Confirm Benchmarking | C1: Step 3 Save to My History

A3: Balance Sheet For the period ended
A4: ASSETS | C4: Amount in Local Currency | D4: PEARLS | E4: Comment
B5: Liquidity
B6: Non-Earning Liquid Assets | C6: 50000 | D6: {ANS6} | E6: {A2}
B7: Liquid Investments (Short Term Investments) | C7: 4694993 | D7: {ANS7} | E7: {E2}
B8: Liquidity Reserves | C8: =SUM(C6:C7) -> 4744993 | D8: {ANS8} | E8: {L1}
B10: Loan Outstanding:
B11: Loans Receivable - Current | C11: 18283473
B13: Loan Delinquent (1-12 months)
B14: Loans Receivable - Restructured | C14: 1679542
B15: Loans Receivable- Past Due for 1-12 months | C15: 5060976
B16: Total Loan Delinquent (1-12 months) | C16: =SUM(C14:C15) -> 6740518 | D16: {ANS16} | E16: {CP2}
B18: Loan Delinquent (> 12 months)
B19: Loans Receivable - Past Due for >12 months | C19: 0
B20: Loans Receivable-Loans in Litigation | C20: 0
B21: Total Loan Delinquent (>12 months) | C21: =SUM(C19:C20) -> 0 | D21: {ANS21} | E21: {CP1}
B22: Total Loan Delinquency | C22: =SUM(C16+C21) -> 6740518 | D22: {ANS22} | E22: {A1}
B23: Total Loan Portfolio | C23: =SUM(C11+C22) -> 25023991 | D23: {ANS23} | E23: {A1}
B25: Allowance for Probable Losses on Loans
B26: Allowance for Probable Losses on Loans - >12 months | C26: 0 | D26: {ANS26} | E26: {CP1}
B27: Allowance for Probable Losses on Loans - 1 to 12 months | C27: 1422659 | D27: {ANS27} | E27: {CP2}
B28: Total Provision for Doubtful Loans | C28: =SUM(C26:C27) -> 1422659
B29: Net Loans Outstanding | C29: =SUM(C23-C28) -> 23601332 | D29: {ANS29} | E29: {E1}
B31: Investments:
B32: Financial Investments | C32: 502502 | D32: {ANS32} | E32: {E3}
B33: Non Financial Investments | C33: 0 | D33: {ANS33} | E33: {E4}
B34: Total Investments | C34: =SUM(C32:C33) -> 502502
B35: Non-Earning Assets | C35: 6511952 | D35: {ANS35} | E35: {A2}
B36: Problem Assets | C36: 0 | D36: {ANS36} | E36: {CP6}
B37: Total Assets | C37: =SUM(C8+C29+C34+C35) -> 35360779 | D37: {ANS37} | E37: {A2}
A39: LIABILITIES
B40: Savings Deposits | C40: 26809988 | D40: {ANS40} | E40: {E5}
B41: Non-Interest Bearing Liabilities & Short Term Payables | C41: 784149 | D41: {ANS41} | E41: {L1}
B42: Non-Interest Bearing Liabilities -Non Short-Term Payables | C42: 1824282
B43: Total Non-Interest Bearing Liabilities | C43: =SUM(C41:C42) -> 2608431 | D43: {ANS43} | E43: {A3}
B45: External Credit
B46: Loans Payable -Short Term | C46: 0 | D46: {ANS46} | E46: {L1}
B47: Loans Payable -Long Term | C47: 0
B48: Total External Credit | C48: =SUM(C46:C47) -> 0 | D48: {ANS48} | E48: {E6}
B49: Total Liabilities | C49: =SUM(C40+C43+C48) -> 29418419
A51: EQUITY
B52: Member Share Capital | C52: 4570462 | D52: {ANS52} | E52: {E7}
B53: Total Institutional Capital | C53: 886998 | D53: {ANS53} | E53: {E8}
B54: Transitory Capital | C54: 484900 | D54: {ANS54} | E54: {A3}
B55: Total Equity | C55: =SUM(C52:C54) -> 5942360
B56: Total Liabilities & Equities | C56: =SUM(C49+C55) -> 35360779
A57: INCOME STATEMENT for the months ended
A58: INCOME
B59: Loan Income | C59: 3103253
B60: Less: Insurance Premiums paid on loans | C60: 0
B61: Net Loan Income | C61: =SUM(C63-C64) -> 3103253 | D61: {ANS65} | E61: {R1}
B62: Total Liquid Investment Income | C62: 1032876 | D62: {ANS66} | E62: {R2}
B63: Total Financial Investment Income | C63: 237348 | D63: {ANS67} | E63: {R3}
B64: Income from Non-Financial Investments | C64: 0 | D64: {ANS68} | E64: {R4}
B65: Total Income | C65: =SUM(C65:C68) -> 4373477
A67: FINANCIAL COSTS
B68: Interest Cost on Savings Deposits | C68: 1174096 | D68: {ANS6} | E68: {R5}
B69: Interest Cost on External Credit