A1: {MEMBER_NAME}
A2: {TOPMENU}

A1: New Benchmarking Services

A1: Step 1 Start Benchmarking (Please complete the form and enter ) | B1: Step 2 Confirm Benchmarking | C1: Step 3 Save to My History

A7: Balance Sheet For the period ended
A8: ASSETS | C8: Amount in Local Currency | D8: % | E8: Chart of Account (Codes)
B9: Liquidity
B10: Non-Earning Liquid Assets | C10: 50000 | D10: =SUM(C6/C37*100) -> 0.14139959982216455 | E10: 101 + 103 + 104
B11: Liquid Investments (Short Term Investments) | C11: 4694993 | D11: =SUM(C7/C37*100) -> 13.277402627357276 | E11: 102 + 140
B12: Liquidity Reserves | C12: =SUM(C6:C7) -> 4744993 | D12: =SUM(C8/C37*100) -> 13.418802227179441
B14: Loan Outstanding: | D14: =SUM(C10/C41*100) -> 0
B15: Loans Receivable - Current | C15: 18283473 | D15: =SUM(C11/C37*100) -> 51.705515311187014 | E15: 150
B17: Loan Delinquent (1-12 months)
B18: Loans Receivable - Restructured | C18: 1679542 | D18: =SUM(C14/C37*100) -> 4.7497313336903577 | E18: 151
B19: Loans Receivable- Past Due for 1-12 months | C19: 5060976 | D19: =SUM(C15/C37*100) -> 14.312399622191583 | E19: 152
B20: Total Loan Delinquent (1-12 months) | C20: =SUM(C14:C15) -> 6740518 | D20: =SUM(C16/C37*100) -> 19.062130955881941
B22: Loan Delinquent (> 12 months)
B23: Loans Receivable - Past Due for >12 months | C23: 0 | D23: =SUM(C19/C37*100) -> 0 | E23: 152
B24: Loans Receivable-Loans in Litigation | C24: 0 | D24: =SUM(C20/C37*100) -> 0 | E24: 153
B25: Total Loan Delinquent (>12 months) | C25: =SUM(C19:C20) -> 0 | D25: =SUM(C21/C52*100) -> 0
B26: Total Loan Delinquency | C26: =SUM(C16+C21) -> 6740518 | D26: {P22}
B27: Total Loan Portfolio | C27: =SUM(C11+C22) -> 25023991 | D27: =SUM(C23/C37*100) -> 70.767646267068955
B29: Allowance for Probable Losses on Loans | E29: 154
B30: Allowance for Probable Losses on Loans - >12 months | C30: 0 | D30: =SUM(C26/C37*100) -> 0
B31: Allowance for Probable Losses on Loans - 1 to 12 months | C31: 1422659 | D31: =SUM(C27/C37*100) -> 4.0232682656680163
B32: Total Provision for Doubtful Loans | C32: =SUM(C26:C27) -> 1422659 | D32: =SUM(C28/C37*100) -> 4.0232682656680163
B33: Net Loans Outstanding | C33: =SUM(C23-C28) -> 23601332 | D33: =SUM(C29/C37*100) -> 66.744378001400932
B35: Investments:
B36: Financial Investments | C36: 502502 | D36: =SUM(C32/C37*100) -> 1.4210716341967466 | E36: 182 + 184
B37: Non Financial Investments | C37: 0 | D37: =SUM(C33/C37*100) -> 0 | E37: 185
B38: Total Investments | C38: =SUM(C32:C33) -> 502502 | D38: =SUM(C34/C37*100) -> 1.4210716341967466
B39: Non-Earning Assets | C39: 6511952 | D39: =SUM(C35/C37*100) -> 18.415748137222881 | E39: 112; 162; 170; 174; 191; 192; 193; 196; 197; 205; 206; 208; 209; 210; 250; 151; 252; 256; 257; 258; 259; 260; 261
B40: Problem Assets | C40: 0 | D40: =SUM(C36/C37*100) -> 0 | E40: May fall under 261
B41: Total Assets | C41: =SUM(C8+C29+C34+C35) -> 35360779 | D41: =SUM(C37/C37*100) -> 100
A43: LIABILITIES
B44: Savings Deposits | C44: 26809988 | D44: =SUM(C40/C56*100) -> 75.818431488740686 | E44: 300; 303
B45: Non-Interest Bearing Liabilities & Short Term Payables | C45: 784149 | D45: =SUM(C41/C56*100) -> 2.2175670960190104 | E45: 308; 309; 310; 311; 312; 313; 314; 316
B46: Non-Interest Bearing Liabilities -Non Short-Term Payables | C46: 1824282 | D46: =SUM(C42/C56*100) -> 5.1590548952555597 | E46: 331; 332; 333; 334
B47: Total Non-Interest Bearing Liabilities | C47: =SUM(C41:C42) -> 2608431 | D47: =SUM(C43/C56*100) -> 7.376621991274571
B49: External Credit | D49: =SUM(C45/C56*100) -> {P45}
B50: Loans Payable -Short Term | C50: 0 | D50: =SUM(C46/C56*100) -> {P46} | E50: 304
B51: Loans Payable -Long Term | C51: 0 | D51: =SUM(C47/C56*100) -> {P46} | E51: 320
B52: Total External Credit | C52: =SUM(C46:C47) -> 0 | D52: =SUM(C48/C56*100) -> {P48}
B53: Total Liabilities | C53: =SUM(C40+C43+C48) -> 29418419 | D53: =SUM(C49/C56*100) -> 83.195053480015247
A55: EQUITY
B56: Member Share Capital | C56: 4570462 | D56: =SUM(C52/C56*100) -> 12.925229956048199 | E56: 361
B57: Total Institutional Capital | C57: 886998 | D57: =SUM(C53/C56*100) -> 2.508423244861206 | E57: 381; 391; 362
B58: Transitory Capital | C58: 484900 | D58: =SUM(C54/C56*100) -> 1.3712933190753518 | E58: 392; 393
B59: Total Equity | C59: =SUM(C52:C54) -> 5942360 | D59: =SUM(C55/C56*100) -> 16.804946519984753
B60: Total Liabilities & Equities | C60: =SUM(C49+C55) -> 35360779 | D60: =SUM(C56/C56*100) -> {P56}
A61: INCOME STATEMENT for the months ended
A62: INCOME
B63: Loan Income | C63: 3103253 | D63: =SUM(C63/C69)*100 -> 70.956198009044058 | E63: 401; 405; 406; 407; 408
B64: Less: Insurance Premiums paid on loans | C64: 0 | D64: {P64} | E64: 553 (portion paid for loan insurance)
B65: Net Loan Income | C65: =SUM(C63-C64) -> 3103253 | D65: =SUM(C65/C69)*100 -> 70.956198009044058
B66: Total Liquid Investment Income | C66: 1032876 | D66: {P66}
B67: Total Financial Investment Income | C67: 237348 | D67: =SUM(C67/C69)*100 -> 5.4269863543354635 | E67: 409
B68: Income from Non-Financial Investments | C68: 0 | D68: =SUM(C66/C69)*100 -> 23.616815636620476 | E68: 410
B69: Total Income | C69: =SUM(C65:C68) -> 4373477 | D69: =SUM(C69/C69 * 100) -> {P69}
A71: FINANCIAL COSTS
B72: Interest Cost on Savings Deposits | C72: 1174096 | D72: =SUM(C72/C69*100) -> 26.845825415338869 | E72: 401
B73: Interest Cost on External Credit | D73: =SUM(C73/C69*100) -> {P73} | E73: 502; 503
B74: Total Financial Costs excluding Interest Cost on Shares | C74: =SUM(C72:C73) -> 1174096 | D74: =SUM(C74/C69*100) -> 26.845825415338869
B75: Gross Income Margin | C75: =SUM(C69-C74) -> 3199381 | D75: =SUM(C75/C69*100) -> 73.154174584661121
A77: OPERATING EXPENSES
B78: Personnel | C78: 300000 | D78: =SUM(C78/C69*100) -> 6.8595307577929425 | E78: 516; 517; 518; 519
B79: Governance | C79: 300000 | D79: =SUM(C79/C69*100) -> 6.8595307577929425 | E79: 538; 539; 560; 561
B80: Marketing | C80: 50000 | D80: =SUM(C80/C69*100) -> 1.1432551262988235 | E80: 566; 567; 568; 570;
B81: Depreciation | C81: 200000 | D81: =SUM(C81/C65*100) -> 6.4448499687263654 | E81: 576; 577
B82: Administration | C82: 2038779 | D82: =SUM(C82/C69*100) -> 46.616890862807786 | E82: 540; 551; 552; 553; 554; 555; 556; 557; 558; 559; 562; 563; 564; 565; 575
B83: Total Operating Expenses before Probable Loss on Delinquent Loans | C83: =SUM(C78:C82) -> 2888779 | D83: =SUM(C83/C69*100) -> 66.052228009887784
B84: Provision for Probable Losses on Loans | C84: 1422659 | D84: =SUM(C82/C69*100) -> 46.616890862807786 | E84: 578
B85: Total Operating Expenses | C85: 1422659 | D85: =SUM(C82/C69*100) -> 46.616890862807786
B86: NET INCOME before other Income/Expense | C86: 1422659 | D86: =SUM(C82/C69*100) -> 46.616890862807786
B87: Other Income/Expense | C87: 1422659 | D87: =SUM(C82/C69*100) -> 46.616890862807786 | E87: 590; 591; 592; 593
B88: Net Income | C88: 1422659 | D88: =SUM(C82/C69*100) -> 46.616890862807786
B90: Allocation of Net Income: | C90: 1422659 | D90: =SUM(C82/C69*100) -> 46.616890862807786
B91: General Reserve Fund | C91: 1422659 | D91: =SUM(C82/C69*100) -> 46.616890862807786
B92: Interest Cost on Shares | C92: 1422659 | D92: =SUM(C82/C69*100) -> 46.616890862807786
B93: Patronage Refund | C93: 1422659 | D93: =SUM(C82/C69*100) -> 46.616890862807786
B94: Other Statutory Accounts | C94: 1422659 | D94: =SUM(C82/C69*100) -> 46.616890862807786
B95: Undivided Net Income | C95: 1422659 | D95: =SUM(C82/C69*100) -> 46.616890862807786
B96: Total | C96: 1422659 | D96: =SUM(C82/C69*100) -> 46.616890862807786
C97: 1422659 | D97: =SUM(C82/C69*100) -> 46.616890862807786
B98: Total Charge off Delinquent Loans | C98: 1422659 | D98: =SUM(C82/C69*100) -> 46.616890862807786
B99: Quarterly Loan Charge Offs | C99: 1422659 | D99: =SUM(C82/C69*100) -> 46.616890862807786
B100: Accumulated Loan Recoveries | C100: 1422659 | D100: =SUM(C82/C69*100) -> 46.616890862807786
B101: Accummulate Loan Charge Offs | C101: 1422659 | D101: =SUM(C82/C69*100) -> 46.616890862807786
B102: Net Loan Portfolio of the previous year | C102: 1422659 | D102: =SUM(C82/C69*100) -> 46.616890862807786
B103: Gross Loan Portfolio of the previous year | C103: 1422659 | D103: =SUM(C82/C69*100) -> 46.616890862807786
B104: Liquid Investment of the previous year | C104: 1422659 | D104: =SUM(C82/C69*100) -> 46.616890862807786
B105: Financial Investments of the previous year | C105: 1422659 | D105: =SUM(C82/C69*100) -> 46.616890862807786
B106: Non-Financial Investment of the previous year | C106: 1422659 | D106: =SUM(C82/C69*100) -> 46.616890862807786
B107: Savings Deposit of the previous year | C107: 1422659 | D107: =SUM(C82/C69*100) -> 46.616890862807786
B108: External Credit of the previous year | C108: 1422659 | D108: =SUM(C82/C69*100) -> 46.616890862807786
B109: Membes Shares of the previous year | C109: 1422659 | D109: =SUM(C82/C69*100) -> 46.616890862807786
B110: Total Assets of the previous year | C110: 1422659 | D110: =SUM(C82/C69*100) -> 46.616890862807786
B111: Institutional Capital of the previous year | C111: 1422659 | D111: =SUM(C82/C69*100) -> 46.616890862807786
B112: Members this year | C112: 1422659 | D112: =SUM(C82/C69*100) -> 46.616890862807786
B113: Members last year | C113: 1422659 | D113: =SUM(C82/C69*100) -> 46.616890862807786
B114: Liquid Assets Income last year | C114: 1422659 | D114: =SUM(C82/C69*100) -> 46.616890862807786
B115: Financial Investment Income last year | C115: 1422659 | D115: =SUM(C82/C69*100) -> 46.616890862807786
B116: Non-Financial Investment Income last year | C116: 1422659 | D116: =SUM(C82/C69*100) -> 46.616890862807786
B117: Financial Cost: Savings Deposit last year | C117: 1422659 | D117: =SUM(C82/C69*100) -> 46.616890862807786
B118: Financial Cost: External Credit last year | C118: 1422659 | D118: =SUM(C82/C69*100) -> 46.616890862807786
B119: Financial Cost: Member Shares last year | C119: 1422659 | D119: =SUM(C82/C69*100) -> 46.616890862807786
C120: 1422659 | D120: =SUM(C82/C69*100) -> 46.616890862807786